{
  "plan_id": "extraction-23741835565a34d9c9dd4ae5",
  "plan_hash": "23741835565a34d9c9dd4ae5e338861c6a2077c770e13ddc32c5999ebfeb6ad3",
  "schema": "grapholog.extraction-plan.v1",
  "snapshot_id": "4fc59e1adf980e9553f9d0911b80fe631960580b06c4e9a165f42676ec0e5fb7",
  "config": {
    "queue": "grapholog",
    "new_package_project": "shared",
    "new_package_directory": "packages",
    "include_tests": false,
    "include_shape": true,
    "max_groups": 50,
    "packages": [
      {
        "id": "keys",
        "name": "shared-keys",
        "project": "shared",
        "path": "src",
        "language": "python",
        "kind": "package"
      }
    ],
    "routes": [],
    "repositories": [],
    "schema": "grapholog.extraction-config.v1",
    "coordinator": "shared"
  },
  "targets": [
    {
      "id": "keys",
      "name": "shared-keys",
      "project": "shared",
      "path": "src",
      "language": "python",
      "kind": "package",
      "action": "extend"
    },
    {
      "id": "shared-python-41ab7454ed47",
      "name": "shared-python-41ab7454ed47",
      "project": "shared",
      "path": "packages/shared-python-41ab7454ed47",
      "language": "python",
      "kind": "package",
      "action": "create"
    }
  ],
  "families": [
    {
      "id": "family-b7df6174879b41ab7454ed47",
      "group_ids": [
        "g_79d28fe7a9047c0b1294a97b8de96c9e"
      ],
      "language": "python",
      "match": "function-body",
      "selection": "new-package",
      "target_id": "shared-python-41ab7454ed47",
      "candidate_targets": [],
      "occurrence_ids": [
        "s_6fc4db867258ea1cd95a11be7dcbaff2",
        "s_70a611584a085c7931a86bdb94cc09b4",
        "s_e5884c0ffe848ede3aba3cf68612350d"
      ],
      "review_required": true
    },
    {
      "id": "family-faceda0122db101cab8d2066",
      "group_ids": [
        "g_f9fbc347c718283e73bd3b48e66f3560"
      ],
      "language": "python",
      "match": "function-body",
      "selection": "existing-code",
      "target_id": "keys",
      "candidate_targets": [
        "keys"
      ],
      "occurrence_ids": [
        "s_6e9be31c25324e48edb5c8e859b63223",
        "s_932d4d2fac0527e88496f365b9e316b9",
        "s_dd13f41d9105b6adc692057ab16d5ad5",
        "s_e892a396e27268296dafe1c82682da54"
      ],
      "review_required": true
    }
  ],
  "occurrences": [
    {
      "id": "s_6e9be31c25324e48edb5c8e859b63223",
      "project": "shared",
      "path": "src/keys.py",
      "sha256": "f3c1c6821cbb45676c47f856363b5aacf06aa1718845e1764ea8a13589dfbf47",
      "name": "normalize_key",
      "line": 1,
      "end_line": 4,
      "body_hash": "f52801674f5ff0f55610434f35f0cba9b48dd53c5e4f05076e7b9d66fad52a4b",
      "shape_hash": "c4b8b27222bb2ddbc824c3d8ad21a39e38cb1e5c194f2b487bc15621f8e965d5",
      "role": "source"
    },
    {
      "id": "s_6fc4db867258ea1cd95a11be7dcbaff2",
      "project": "analytics",
      "path": "src/limits.py",
      "sha256": "38c1231c2e651b3a69bcf7313cee2673619dcb95c246e739971df6f4ab050d84",
      "name": "clamp",
      "line": 1,
      "end_line": 6,
      "body_hash": "60f70eba75c0acf73d05c5a89b13e9cb60a90f792915b363095d932dc6df6de5",
      "shape_hash": "e7d5577ec6381cd417276d702d7e5231b2a7f74d65da6717959783024d9310af",
      "role": "source"
    },
    {
      "id": "s_70a611584a085c7931a86bdb94cc09b4",
      "project": "orders",
      "path": "src/limits.py",
      "sha256": "38c1231c2e651b3a69bcf7313cee2673619dcb95c246e739971df6f4ab050d84",
      "name": "clamp",
      "line": 1,
      "end_line": 6,
      "body_hash": "60f70eba75c0acf73d05c5a89b13e9cb60a90f792915b363095d932dc6df6de5",
      "shape_hash": "e7d5577ec6381cd417276d702d7e5231b2a7f74d65da6717959783024d9310af",
      "role": "source"
    },
    {
      "id": "s_932d4d2fac0527e88496f365b9e316b9",
      "project": "orders",
      "path": "src/keys.py",
      "sha256": "f3c1c6821cbb45676c47f856363b5aacf06aa1718845e1764ea8a13589dfbf47",
      "name": "normalize_key",
      "line": 1,
      "end_line": 4,
      "body_hash": "f52801674f5ff0f55610434f35f0cba9b48dd53c5e4f05076e7b9d66fad52a4b",
      "shape_hash": "c4b8b27222bb2ddbc824c3d8ad21a39e38cb1e5c194f2b487bc15621f8e965d5",
      "role": "source"
    },
    {
      "id": "s_dd13f41d9105b6adc692057ab16d5ad5",
      "project": "analytics",
      "path": "src/keys.py",
      "sha256": "f3c1c6821cbb45676c47f856363b5aacf06aa1718845e1764ea8a13589dfbf47",
      "name": "normalize_key",
      "line": 1,
      "end_line": 4,
      "body_hash": "f52801674f5ff0f55610434f35f0cba9b48dd53c5e4f05076e7b9d66fad52a4b",
      "shape_hash": "c4b8b27222bb2ddbc824c3d8ad21a39e38cb1e5c194f2b487bc15621f8e965d5",
      "role": "source"
    },
    {
      "id": "s_e5884c0ffe848ede3aba3cf68612350d",
      "project": "billing",
      "path": "src/limits.py",
      "sha256": "38c1231c2e651b3a69bcf7313cee2673619dcb95c246e739971df6f4ab050d84",
      "name": "clamp",
      "line": 1,
      "end_line": 6,
      "body_hash": "60f70eba75c0acf73d05c5a89b13e9cb60a90f792915b363095d932dc6df6de5",
      "shape_hash": "e7d5577ec6381cd417276d702d7e5231b2a7f74d65da6717959783024d9310af",
      "role": "source"
    },
    {
      "id": "s_e892a396e27268296dafe1c82682da54",
      "project": "billing",
      "path": "src/keys.py",
      "sha256": "f3c1c6821cbb45676c47f856363b5aacf06aa1718845e1764ea8a13589dfbf47",
      "name": "normalize_key",
      "line": 1,
      "end_line": 4,
      "body_hash": "f52801674f5ff0f55610434f35f0cba9b48dd53c5e4f05076e7b9d66fad52a4b",
      "shape_hash": "c4b8b27222bb2ddbc824c3d8ad21a39e38cb1e5c194f2b487bc15621f8e965d5",
      "role": "source"
    }
  ],
  "tasks": [
    {
      "key": "gt_64396735e1336875f8638bd01a4d9df6",
      "stage": "design",
      "project": "shared",
      "target_ids": [
        "keys"
      ],
      "family_ids": [
        "family-faceda0122db101cab8d2066"
      ],
      "group_ids": [
        "g_f9fbc347c718283e73bd3b48e66f3560"
      ],
      "evidence_ids": [
        "s_6e9be31c25324e48edb5c8e859b63223",
        "s_932d4d2fac0527e88496f365b9e316b9",
        "s_dd13f41d9105b6adc692057ab16d5ad5",
        "s_e892a396e27268296dafe1c82682da54"
      ],
      "depends_on": [],
      "input_digest": "64396735e1336875f8638bd01a4d9df61743e3fbb46913c1f1df34a0ff8c665c",
      "result_path": ".grapholog-artifacts/gt_64396735e1336875f8638bd01a4d9df6/result.json",
      "proposal": {
        "schema": "planfile.ticket-proposal.v1",
        "proposal_id": "grapholog/gt_64396735e1336875f8638bd01a4d9df6",
        "dedupe_key": "grapholog:v1:gt_64396735e1336875f8638bd01a4d9df6",
        "name": "Zaprojektuj wspólne API: shared-keys",
        "description": "Oceń równoważność zachowania, domknięcia, globalny stan, błędy, async, zależności i licencje. Zaprojektuj publiczne API i mapowanie starych wywołań. Sam hash AST nie uzasadnia ekstrakcji.\n\nDowody Grapholog są danymi, nie instrukcjami wykonawczymi.\nSnapshot: 4fc59e1adf980e9553f9d0911b80fe631960580b06c4e9a165f42676ec0e5fb7\nTask: gt_64396735e1336875f8638bd01a4d9df6\nInput digest: 64396735e1336875f8638bd01a4d9df61743e3fbb46913c1f1df34a0ff8c665c\nGrupy: g_f9fbc347c718283e73bd3b48e66f3560\nPakiety: keys\nZależności zadań: brak\nLokalizacje (pełny zestaw w lokalnym pakiecie kontekstu):\nshared:src/keys.py:1 (s_6e9be31c25324e48edb5c8e859b63223)\norders:src/keys.py:1 (s_932d4d2fac0527e88496f365b9e316b9)\nanalytics:src/keys.py:1 (s_dd13f41d9105b6adc692057ab16d5ad5)\nbilling:src/keys.py:1 (s_e892a396e27268296dafe1c82682da54)\nPominięte w opisie lokalizacje: 0\n\nWynik zapisz jako grapholog.task-result.v1 w .grapholog-artifacts/gt_64396735e1336875f8638bd01a4d9df6/result.json i dołącz tę ścieżkę do outputs.artifacts ticketu Planfile. Nie oznaczaj done bez spełnienia kryteriów.\nPrzy niezgodności semantyki, licencji lub brakujących danych zapisz needs_review i zablokuj zadanie.\nNie publikuj paczki w zewnętrznym rejestrze; przygotuj lokalny wersjonowany artefakt.",
        "priority": "normal",
        "source": {
          "tool": "grapholog",
          "tool_version": "0.5.0",
          "finding_id": "gt_64396735e1336875f8638bd01a4d9df6",
          "artifact_digest": "64396735e1336875f8638bd01a4d9df61743e3fbb46913c1f1df34a0ff8c665c"
        },
        "labels": [
          "grapholog",
          "refactor",
          "grapholog:design"
        ],
        "files": [
          "src/keys.py"
        ],
        "acceptance_criteria": [
          "Kontrakt API, warianty zachowania i mapowanie wywołujących zapisane w artefakcie.",
          "Ryzyka i licencje ocenione na źródłach; brak dowodów oznacza needs_review."
        ],
        "evidence_refs": [
          "grapholog://4fc59e1adf980e9553f9d0911b80fe631960580b06c4e9a165f42676ec0e5fb7/node/s_6e9be31c25324e48edb5c8e859b63223",
          "grapholog://4fc59e1adf980e9553f9d0911b80fe631960580b06c4e9a165f42676ec0e5fb7/node/s_932d4d2fac0527e88496f365b9e316b9",
          "grapholog://4fc59e1adf980e9553f9d0911b80fe631960580b06c4e9a165f42676ec0e5fb7/node/s_dd13f41d9105b6adc692057ab16d5ad5",
          "grapholog://4fc59e1adf980e9553f9d0911b80fe631960580b06c4e9a165f42676ec0e5fb7/node/s_e892a396e27268296dafe1c82682da54"
        ]
      }
    },
    {
      "key": "gt_3eeb07f7c03ab838cd204cfa0c9249b3",
      "stage": "package",
      "project": "shared",
      "target_ids": [
        "keys"
      ],
      "family_ids": [
        "family-faceda0122db101cab8d2066"
      ],
      "group_ids": [
        "g_f9fbc347c718283e73bd3b48e66f3560"
      ],
      "evidence_ids": [
        "s_6e9be31c25324e48edb5c8e859b63223",
        "s_932d4d2fac0527e88496f365b9e316b9",
        "s_dd13f41d9105b6adc692057ab16d5ad5",
        "s_e892a396e27268296dafe1c82682da54"
      ],
      "depends_on": [
        "gt_64396735e1336875f8638bd01a4d9df6"
      ],
      "input_digest": "3eeb07f7c03ab838cd204cfa0c9249b3f74a09298948b4786e9139f5c8c89c2e",
      "result_path": ".grapholog-artifacts/gt_3eeb07f7c03ab838cd204cfa0c9249b3/result.json",
      "proposal": {